Query_number,Query,doc_text,doc_number,index,label
2, androgen receptor define,"Video Writeups The Ultimate Guide to Sarms Last updated Jan 9, 2018Overview: What are SARMs? Steroidal VS Non Steroidal SARMs SARMS vs. Prohormones How Do SARMS Work? The Most Popular SARMSThe Benefits of SARMSSide Effects of SARMSWhere to Buy Selective Androgen Receptor Modulators Online Stacking Your SARMs: Your Best Options SARMs: Our Final Review FAQs Do you need a PCT after using SARMs? Have you heard of SARMS a.k.a. Selective Androgen Receptor Modulators? It’s dubbed as a steroid alternative that’s said to be the most efficient for cycling steroids and PCT (post cycle therapy). Today, I’ll talk about SARMS and give you the 401 to help give you a glimpse on everything there is to know about it. What are SARMs? The topic of SARMs (or selective androgen receptor modulators) have been a controversial one since the early 90s when they were first introduced in mainstream science. Now this isn’t to say that SARMs haven’t been around long before this period. In the 1940s, steroidal SARMs have been used for medical use in multiple diseases including cancer, hypogonadism, osteoporosis, and a number of other diseases that affect muscle and bone wasting. These SARMs had a very strong effect on muscle building due to its “high affinity”, which in non-scientific terms means it’s attraction to a receptor is high and that is what makes a chemical reaction in the body more powerful. Unfortunately, steroidal SARMs came with side effects such as estrogen conversion causing gynecomastia (puffy sensitive nipples in men), decreased libido, and damage to the liver and kidneys (related to its methylation). Another side effect was that steroids can change the DNA of multiple cells such as the prostate and heart cause them to enlarge. Steroidal VS Non Steroidal SARMs In the early 1990s, scientist created a non-steroidal version of these SARMs by making them protein based. The difference between these two types of SARMs is most easily described as a lock and key system. The cells in the body act as locks and the binding sites of the cells are like key holes. Steroidal SARMs have the ability to act like a master key unlocking every cell to promote protein synthesis and growth, even in cells you don’t want to “unlock”. Nonsteroidal SARMs are designed specifically for one type of lock, therefore, it will only affect areas of the DNA that prevent muscle and bone wastage while also promoting growth in these areas. Nonsteroidal SARMs have been used for bodybuilding, powerlifting and a multitude of other sports since the start of it popularity. Their benefit to side effect ratio have been tested since the 1990s with no evidence suggesting harm. This breakthrough in scientific technology continues to suggest SARMs is the future of anabolics and will eventually replace steroid therapy. Now this is not to say that nonsteroidal SARMs are the answers to all our problems. Although a protein based SARMs have very limited side effects with large benefits for strength and muscle gains, they also require a much longer period of use and cannot yet compare to the effectiveness of a steroid. The comparison of benefits and unwanted side effects have been researched for decades. Unlike testosterone cypionate, SARMS are more than 200 times more powerful in muscle stimulation and 80 times more selective for muscle. SARMS vs. Prohormones Prohormones were the first ones introduced to the market. However, steroids or testosterone supplements don’t have the muscle growth effects of authentic steroids and they carry the same adverse side effects making them unsafe for human use. Meanwhile, SARMS are an upgrade of anabolic steroids. It can be administered orally, minimizing the effects in testosterone blood levels. SARMS are also believed to cure various diseases which steroids and other medicines treated earlier. It also shows promise to replace androgen which can yield similar desirable results on muscle tissue as steroids. According to a study conducted by the World Anti-doping Agency (WADA), approximately tenth of the worlds athletic population uses SARMS (particularly Ostarine) to enhance their body and performance (which is considered a safe performance boost). Studies have shown the ability of SARMs to increase muscle and bone mass dramatically in animals while having no adverse impact on the prostate. Phase I trials of SARMs in humans have also reported significant increases in lean muscle mass. The two most talked about SARMs among bodybuilders are SARM S-4 a.k.a. Acetamidoxolutamide and SARM S-1: a.k.a. Ostarine or MK 2866. How Do SARMS Work? As we age, our endurance, power and skeletal muscle mass deteriorates due to the loss of type 2 muscle fibers. This hinders individuals to function normally. With SARMS, skeletal muscle mass and strength in androgen-deficient people can be enhanced. There are 2 types of administering SARMS – orally or in injectable dosages. The anabolic effect is expected to be the same as testosterone. Moreover, it’s also said to produce dose-dependent improvements in bone mineral density and motorized strength apart from the ability to decrease body fat and increase lean body mass. SARMS link to the same receptors that old steroids such as Dianabol and testosterone would connect to, but minus the drawbacks and side effects of traditional steroids and prohormones. This is a fresh start in the advancement of muscle pharmacology as SARMS can help enhance muscle mass, while helping you reduce body fat and boost athletic performance beyond your imagination. The Most Popular SARMSThere are many SARMS, but here are the 4 main SARMS that are currently offered and most applicable to athletes, bodybuilders and fitness enthusiasts: LGD-4033 – a potent, non-steroidal bodybuilding supplement for enhancing lean muscle mass and reducing body fat Ostarine (MK-2866) – selective for anabolic activity at certain ARs, great for maintaining and increasing lean body mass and recomping S4 (Andarine) – selective for bone tissue (mostly low virilization), aimed to cure osteoporosis and won’t produce the development of prostate and other secondary sexual organs RAD140 – this is probably one of the most exciting SARMs, as well as the most current. In fact, aside from the muscle building effects seems to look like a possible cure for Alzheimer. Other compounds like GW 501516 (Cardarine) considered the kind of endurance supplements and SR9009 are usually grouped with SARMs, but are not the same. The Benefits of SARMSSARMS is believed to have the capacity to employ the benefits of anabolic supplements while reducing the side effects of steroids. Non-toxic (won’t cause liver damage)Avoids bone loss (direct action of testosterone in bone thru the AR-mediated conduit is critical for its anabolic effects in bone)Decreases the threat of prostate problems in men without muscle mass loss Won’t impede your HPTASimilar effects with testosterone No estrogen and Dihydrotestosterone (a hydrogen hormone) conversion For muscle builders, taking SARMS will give: Muscle loss prevention (during cutting period)Lean muscle development Improved strength Faster injury recovery Joint healing abilities PCT use following anabolics Let’s a took at a few of these benefits in more detail…Increased muscle strength In the Asian Journal of Andrology, subjects increased muscle strength 20x more than those in the placebo group. Subjects continued to gain strength and size in muscle tissue for up to 5 months but with significant decreases in effectiveness after the 3rd month (Dalton et al, 2014). Increased muscle size Deductive evidence has proven a significant increase in muscle tissue hypertrophy (growth of muscle tissue). Inductive evidence suggests subjects will gain between 3 to 15 lbs of muscle tissue over the a 12 week period (Dubois et al, 2015). The amount of muscle hypertrophy is dependent on diet, training, and the characteristics of the SARM. Mild SARMs such as MK2866 will range much lower in hypertrophy than more potent SARMs such as RAD140 or LGD4033. Tissue selectivity According to the Oxford Academic journal of Endocrinology, nonsteroidal SARMs have been designed to attach itself to area of the DNA responsible for skeletal muscle protein synthesis. Unlike other anabolic agents, non steroidal SARMs do not affect any other tissues in the body (Dubois et al, 2015). Inhibits cancer cell division In an unrelated study to muscle growth performed by the Public Library of Science’s (PLOS) Peer Reviewed Open Access Journal, nonsteroidal SARMs have been studied for its effects on breast cancer. Androgen receptors are known to play a pivotal role in the treatment of breast cancer and due to the inability for nonsteroidal SARMs to convert to estrogen, there is a very narrow probability for negative repercussions. The results have not only confirmed that tumor cells decrease in weight by 90%, but it may even inhibit the potential for breast cancer development (Dalton et al, 2014). Regulation of libido Recent studies have indicated healthy increases in sexual desire in both men and women with the use of nonsteroidal SARMs. The males with hypogonadism, testosterone therapy is a common practice. In testosterone therapy there are many side effects that result is severe consequences for the user, such as thickening of the blood (commonly causing strokes and heart attacks), enlargement or development of cancer on the prostate, and gynecomastia (characterized as the development of female breast on men) due to an overproduction of estrogen. A 2014 article published by the Asian Journal of Andrology stated “SARM’s beneficial pharmacology and desirable pharmacokinetics offer considerable promise in the treatment of late onset hypogonadism. The convenience of once daily oral therapy combined with defined safety margins surrounding a proven efficacious dosage form may one day challenge testosterone replacement therapy as the gold standard in treating late onset hypogonadism” (Dalton et al, 2014). In the Journal of Pharmacology and Experimental Therapeutics, Researcher reported positive effects of nonsteroidal SARMs on females with low sexual motivation indicating noticeable increases in sexual desire (Jones et al, 2010). Safety and tolerability In the Oxford Journal of Gerontology Series A: Biological Sciences and Medical Sciences, the popular nonsteroidal SARM LGD 4033 (Ligandrol) has been recently studied for it’s effectiveness and safety in healthy young men. Results were favorable indicated by hormone and lipid levels returning to normal without the use of a post cycle therapy. No dangers were detected throughout the study. although there was noticeable suppression in testosterone and HDL cholesterol, it was not significant enough to cause adverse reactions. Because LGD 4033 is considered one of the strongest and most potent nonsteroidal SARMs available, it is not likely that less potent SARMs will produce any harmful effects (Bhasin, 2010). Side Effects of SARMSWhat’s great about SARMS is that its side effects are minimal, so you don’t have to worry about any negative effects. If you overdo it, however, some people may experience shut down or even gynecomastia if currently predisposed to it. Be responsible, and in 99.9% of cases users will not have any side effects from the use of SARMs. Current research has so far agreed with that conclusion. Where to Buy Selective Androgen Receptor Modulators Online There are many manufacturers selling SARMs online right now. Although they are not legal for human consumption, you can buy them from many research labs to experiment with your rat. There are multiple companies selling SARMs online, and the only place I’ve been going to has been the company Innovative Research Chemicals. In fact, as of January 8th 2018 of this year, their popularity all over reddit and solid reputation caused them to upgrade to a bigger facility. You can check out their homepage for a selection of SARMs and other useful compounds. Stacking Your SARMs: Your Best Options When it comes to SARMs, many people stack more than 1 at a time to maximize their results even further. Since in most cases you won’t experience any side effects using SARMs, you can safely stack multiple compounds and do a total recomp of your physique. KONG is a 5 SARM compound available at Powersupps UKFor the best stack right now, I highly recommend you check out a product called KONG by Medfit Nutrition. This is a capsule containing 5 different SARMs in one. It’s probably the strongest SARM product we’ve seen online right now. Popular stacks for SARMs include: LGD 4033 + MK 677GW 501516 + MK 2866SR 9009 + S23Liquid SARMs are harder to stack because of the pure taste and inconvenience of having to measure it out multiple times a day. Plus it tends to be much more expensive. That’s why capsules are your best bet for stacking, while liquids are best for taking one SARM at a time. SARMs: Our Final Review With SARMS showing great promise for selective high anabolic muscle activity and in preventing muscle wasting and age related illnesses without the negative side effects associated with anabolic steroids and prohormones, SARMS could be the next big thing. The IOC (International Olympic Committee) is even preparing for the use of SARMS with Olympic athletes. It’s Anabolics 3.0 and the “Universal Soldier Formula” of the future!What are your thoughts on SARMS? Feel free to leave a comment below. FAQsa Do you need a PCT after using SARMs? Miller, Chris P., Maysoun Shomali, C. Richard Lyttle, Louis St. L. O’Dea, Hillary Herendeen, Kyla Gallacher, Dottie Paquin, Dennis R. Compton, Bishwabhusan Sahoo, Sean A. Kerrigan, Matthew S. Burge, Michael Nickels, Jennifer L. Green, John A. Katzenellenbogen, Alexei Tchesnokov, and Gary Hattersley. “Design, Synthesis, and Preclinical Characterization of the Selective Androgen Receptor Modulator (SARM) RAD140 .” ACS Medicinal Chemistry Letters. American Chemical Society, 10 Feb. 2011. Web. 22 Apr. 2017. Dubois, Vanessa, Ioannis Simitsidellis, Michaël R. Laurent, Ferran Jardi, Philippa T. K. Saunders, Dirk Vanderschueren, and Frank Claessens. “Enobosarm (GTx-024) Modulates Adult Skeletal Muscle Mass Independently of the Androgen Receptor in the Satellite Cell Lineage.” Endocrinology. Oxford University Press, 01 Dec. 2015. Web. 22 Apr. 2017. Dubois, V., I. Simitsidellis, M. R. Laurent, F. Jardi, P. T. Saunders, D. Vanderschueren, and F. Claessens. “Enobosarm (GTx-024) Modulates Adult Skeletal Muscle Mass Independently of the Androgen Receptor in the Satellite Cell Lineage.” Endocrinology. U. S. National Library of Medicine, Dec. 2015. Web. 22 Apr. 2017. Basaria, Shehzad, Lauren Collins, E. Lichar Dillon, Katie Orwoll, Thomas W. Storer, Renee Miciek, Jagadish Ulloor, Anqi Zhang, Richard Eder, Heather Zientek, Gilad Gordon, Syed Kazmi, Melinda Sheffield-Moore, and Shalender Bhasin. “The Safety, Pharmacokinetics, and Effects of LGD-4033, a Novel Nonsteroidal Oral, Selective Androgen Receptor Modulator, in Healthy Young Men.” The Journals of Gerontology Series A: Biological Sciences and Medical Sciences. Oxford University Press, Jan. 2013. Web. 22 Apr. 2017. Mohler, M. L., C. E. Bohl, A. Jones, C. C. Coss, R. Narayanan, Y. He, D. J. Hwang, J. T. Dalton, and D. D. Miller. “Nonsteroidal selective androgen receptor modulators (SARMs): dissociating the anabolic and androgenic activities of the androgen receptor for therapeutic benefit.” Journal of medicinal chemistry. U. S. National Library of Medicine, 25 June 2009. Web. 22 Apr. 2017. Coss, Christopher C., Amanda Jones, Michael L. Hancock, Mitchell S. Steiner, and James T. Dalton. “Selective androgen receptor modulators for the treatment of late onset male hypogonadism.” Asian Journal of Andrology. Medknow Publications & Media Pvt Ltd, 2014. Web. 22 Apr. 2017. Dalton, J. T., R. P. Taylor, M. L. Mohler, and M. S. Steiner. “Selective androgen receptor modulators for the prevention and treatment of muscle wasting associated with cancer.” Current opinion in supportive and palliative care. U. S. National Library of Medicine, Dec. 2013. Web. 22 Apr. 2017. Narayanan, Ramesh, Sunjoo Ahn, Misty D. Cheney, Muralimohan Yepuru, Duane D. Miller, Mitchell S. Steiner, and James T. Dalton. “Selective Androgen Receptor Modulators (SARMs) Negatively Regulate Triple-Negative Breast Cancer Growth and Epithelial: Mesenchymal Stem Cell Signaling.” PLo S ONE. Public Library of Science, 2014. Web. 22 Apr. 2017. Jayaraman, Anusha et al. “Selective Androgen Receptor Modulator RAD140 Is Neuroprotective in Cultured Neurons and Kainate-Lesioned Male Rats.” Endocrinology 155.4 (2014): 1398–1406. PMC. Web. 23 Apr. 2017. ",177589,37451,1
2, androgen receptor define,"Category: SARMSSARMS Reviewed and Explained Dylan Gemelli January 17, 2016 SARMS 32 Comments What are SARMS? SARMS DEFINED: The word SARM stands for “Selective Androgen Receptor Modulator,” and just like the other selective receptor modulators, SARMS can either block, or stimulate, the … [Continue Reading...]Stenabolic (SR9009)Dylan Gemelli January 2, 2016 SARMS 1 Comment Stenabolic (SR9009) is a PPAR alpha modifier drug that is still in development as of 2015. Its creator is professor Thomas Burris of the Scripps research institute. Interestingly, it … [Continue Reading...]RAD140Dylan Gemelli December 30, 2015 SARMS No Comments Testolone (RAD140) is a selective androgen receptor modulator (SARM) that is still under development by Radius Health Inc. What are sarms? SARMS are in the class of androgen receptor … [Continue Reading...]Mini-PCT for SARMs cycles Kai Bogartti August 18, 2015 SARMS 2 Comments What are SARMs? SARMs are selective androgen receptor modulators that were designed to have the same effects as anabolic steroids. However, since they possess a selective action mode, SARMs … [Continue Reading...]Nutrobal (Mk-677)Kai Bogartti August 13, 2015 SARMS No Comments Profile Nutrobal (Mk-677) is a potent growth hormone (GH) secretagogue, which mimics GH’s stimulating action of ghrelin – an endogenous hormone. It has been studied over the past decade … [Continue Reading...]Anabolicum (LGD-4033)Kai Bogartti August 11, 2015 SARMS No Comments Profile LGD-4033 (anabolicum) is the strongest in its class selective androgen receptor modulator (SARM). As a matter of fact, it is one of the newest SARMs that have come … [Continue Reading...]Andarine (S4)Kai Bogartti August 9, 2015 SARMS No Comments Profile Andarine (S4) was developed by GTX Inc. for the treatment of muscle wasting, osteoporosis and BPH (enlargement of the prostate). It belongs to the class of drugs called … [Continue Reading...]Ostarine (MK-2866)Kai Bogartti August 2, 2015 SARMS No Comments Profile Also known as MK-2866, enobasarm, or gtx-024, Ostarine is a very popular SARM (selective androgen receptor modulator). Originally, it was developed to prevent and treat muscle wasting, as … [Continue Reading...]Cardarine (GW 501516)Kai Bogartti July 26, 2015 SARMS No Comments Profile In spite of the fact that many consider cardarine (GW 501516) to be a SARM, it is technically a PPAR-delta agonist (peroxisome proliferator-activated receptors). In fact, it is … [Continue Reading...]SARMSKai Bogartti July 12, 2015 SARMS No Comments SARM’s Profile SARM is a term that is becoming more and more popular in today’s bodybuilding community, but many do not fully understand what they are or what they … [Continue Reading...] ",193130,37452,1
